{
  "$schema": "../../schema.json",
  "id": "sample-extension",
  "title": "Ukazkove rozsireni",
  "description": "Ukazkove rozsireni demonstrujici format manifestu galerie.",
  "author": {
    "name": "Microsoft",
    "url": "https://github.com/microsoft/PowerToys"
  },
  "homepage": "https://github.com/microsoft/PowerToys",
  "readme": "README.md",
  "icon": "icon.png",
  "tags": [
    "sample",
    "reference",
    "template"
  ],
  "installSources": [
    {
      "type": "url",
      "uri": "https://github.com/microsoft/PowerToys/releases"
    }
  ]
}
